Title,Publisher,Description,Paid,Downloads,Views,Likes,Price,Link
Tyrannosaurus Rex 3.1,3dartstevenz,"['This Trex was sculpted in zbrush, textured in Substance Painter and Photoshop, rigged and animated in blender. \nTextures png 4096x4096. \n3 different animations: run, walk and waiting pose', 'Tyrannosaurus is a genus of large theropod dinosaur. The species Tyrannosaurus rex (rex meaning king in Latin), often called T. rex or colloquially T-Rex, is one of the best represented theropods. Tyrannosaurus lived throughout what is now western North America, on what was then an island continent known as Laramidia. Tyrannosaurus had a much wider range than other tyrannosaurids. Fossils are found in a variety of rock formations dating to the Maastrichtian age of the Upper Cretaceous period, 68 to 66 million years ago. It was the last known member of the tyrannosaurids and among the last non-avian dinosaurs to exist before the Cretaceous–Paleogene extinction event.', 'artstation', 'instagram']",1,n/a,48318,764,$14.99 ,https://sketchfab.com/3d-models/tyrannosaurus-rex-31-f1bd8fcd553241a695712edab73ad81f
Dinosaur Fossil Footprint,MADD Designs,['a photoscanned 3-toed therapod footprint.\napproxomately 12” long'],1,n/a,249,5,$6.99 ,https://sketchfab.com/3d-models/dinosaur-fossil-footprint-d2e820fd534f4796b7c45c08970563e6
Dinosaur Fossil Statue,High Sierra 3D,"['Photo-real, unlit, texturized model of a Baby Dinosaur Fossil Statue. This object was generated using photogrammetry with a DSLR camera and images edited in Light Room, compiled in Reality Capture, and re-topologized in Insta-Mesh. The mesh is edited in Agisoft, and model retextured in Reality Capture.', 'Included Files:', '3D Object File Types:', '.OBJ', '.STL', '.X3d', '.XML', 'Maps:', 'Normal', 'Bent Normal', 'Ambient Occlusion (AO)', 'Base Texture', 'Texture', 'Texture File Types:', '.PNG', '.JPG', '.TIFF', 'High-Poly Model or GLB File available upon request.', 'For more information and contact info, visit us at highsierra3d.com']",1,n/a,1951,14,$25 ,https://sketchfab.com/3d-models/dinosaur-fossil-statue-f6941f935b2a40c9a5b3b05ca0093d3e
Iguanodon skull,SenYul,"['This fossilized skull belongs to the Iguanodon, a genus of dinosaur that lived around early Cretaceous. The name means ‘iguana tooth’, and was the first recognised dinosaur, second dinosaur type to be formally named, and one of the original three used to define the Dinosauria classification. Alt+Shift+LMB to change lighting.', 'You can find this fossil and many more inside the Oxford University Museum of Natural History.', 'Photogrammetric reconstruction based on a January 2019 dataset of 191x12MP photos. Quad retopology. 5M > 45k vertex decimation. 4k PBR textures.\nThe animation aims to demonstrate the advantages of 3D scanning as a nondestructive tool to preserve, isolate, and rebuild museum exhibits.', '']",1,n/a,4608,93,$75 ,https://sketchfab.com/3d-models/iguanodon-skull-3537a5b3072b42cbbb7ea51286c75dc4
Dinosaur Fossil,digikstudio,"['Hello.\nWe make objects and backgrounds for webtoons with sketchup.', 'But you can use it anywhere else.', '-', 'This is Dinosaur Fossil ', 'I hope you use it well.If you need any help, contact me I’ll help you.', 'If you like it please click ‘Like’ :)']",1,n/a,190,4,$5 ,https://sketchfab.com/3d-models/dinosaur-fossil-7a5c162838dd4cb28d9b7c0588a4b140
Juvenile Triceratops Fossil,PhotoGramGear,"['From the Triceratops Horridus family.\nReprocessed an old set of photos, then baked and reduced it down to a realtime asset.']",1,n/a,1861,35,$25 ,https://sketchfab.com/3d-models/juvenile-triceratops-fossil-51b6e27147b043ef9fb266a7cda57e35
Dinosaur Fossil Statue,High Sierra 3D,"['Photo-real, unlit, texturized model of a Baby Dinosaur Fossil Statue. This object was generated using photogrammetry with a DSLR camera and images edited in Light Room, compiled in Reality Capture, and re-topologized in Insta-Mesh. The mesh is edited in Agisoft, and model retextured in Reality Capture.', 'Included Files:', '3D Object File Types:', '.OBJ', '.STL', '.X3d', '.XML', 'Maps:', 'Normal', 'Bent Normal', 'Ambient Occlusion (AO)', 'Base Texture', 'Texture', 'Texture File Types:', '.PNG', '.JPG', '.TIFF', 'High-Poly Model or GLB File available upon request.', 'For more information and contact info, visit us at highsierra3d.com']",1,n/a,1951,14,$25 ,https://sketchfab.com/3d-models/dinosaur-fossil-statue-f6941f935b2a40c9a5b3b05ca0093d3e
Tyrannosaurus Rex 3.1,3dartstevenz,"['This Trex was sculpted in zbrush, textured in Substance Painter and Photoshop, rigged and animated in blender. \nTextures png 4096x4096. \n3 different animations: run, walk and waiting pose', 'Tyrannosaurus is a genus of large theropod dinosaur. The species Tyrannosaurus rex (rex meaning king in Latin), often called T. rex or colloquially T-Rex, is one of the best represented theropods. Tyrannosaurus lived throughout what is now western North America, on what was then an island continent known as Laramidia. Tyrannosaurus had a much wider range than other tyrannosaurids. Fossils are found in a variety of rock formations dating to the Maastrichtian age of the Upper Cretaceous period, 68 to 66 million years ago. It was the last known member of the tyrannosaurids and among the last non-avian dinosaurs to exist before the Cretaceous–Paleogene extinction event.', 'artstation', 'instagram']",1,n/a,48318,764,$14.99 ,https://sketchfab.com/3d-models/tyrannosaurus-rex-31-f1bd8fcd553241a695712edab73ad81f
Iguanodon skull,SenYul,"['This fossilized skull belongs to the Iguanodon, a genus of dinosaur that lived around early Cretaceous. The name means ‘iguana tooth’, and was the first recognised dinosaur, second dinosaur type to be formally named, and one of the original three used to define the Dinosauria classification. Alt+Shift+LMB to change lighting.', 'You can find this fossil and many more inside the Oxford University Museum of Natural History.', 'Photogrammetric reconstruction based on a January 2019 dataset of 191x12MP photos. Quad retopology. 5M > 45k vertex decimation. 4k PBR textures.\nThe animation aims to demonstrate the advantages of 3D scanning as a nondestructive tool to preserve, isolate, and rebuild museum exhibits.', '']",1,n/a,4608,93,$75 ,https://sketchfab.com/3d-models/iguanodon-skull-3537a5b3072b42cbbb7ea51286c75dc4
Dinosaur Fossil,digikstudio,"['Hello.\nWe make objects and backgrounds for webtoons with sketchup.', 'But you can use it anywhere else.', '-', 'This is Dinosaur Fossil ', 'I hope you use it well.If you need any help, contact me I’ll help you.', 'If you like it please click ‘Like’ :)']",1,n/a,190,4,$5 ,https://sketchfab.com/3d-models/dinosaur-fossil-7a5c162838dd4cb28d9b7c0588a4b140
Dinosaur fossile,mtaesiri,['The Royal Tyrrell Museum of Palaeontology'],0,40,128,5,n/a,https://sketchfab.com/3d-models/dinosaur-fossile-eee9e9fa837a4c828a4eaea9b7ff249c
Dinosaur Fossil Footprint,MADD Designs,['a photoscanned 3-toed therapod footprint.\napproxomately 12” long'],1,n/a,249,5,$6.99 ,https://sketchfab.com/3d-models/dinosaur-fossil-footprint-d2e820fd534f4796b7c45c08970563e6
Animated triceratops skeleton,Zacxophone,"['This is a beautiful scan Licenced under CC0 Public Domain that I found here  made by The @Smithsonian Institution. ', 'I spent a couple of days cleaning and rigging the mesh to be able to animate it. I wanted to do a short looping animation by starting and finishing it with the same initial scan position', 'Made with Blender\n\nIf you have any questions, do not hesitate to contact me.', '\n ']",0,6145,24472,507,n/a,https://sketchfab.com/3d-models/animated-triceratops-skeleton-06cb55f941d94dc8b95ac46f92d89e7c
Coelophysis,Matthew Schroyer,"['Coelophysis was a carnivorous theropod that lived during the late Triassic (203-198 MYA), in what is now known as the southwestern United States. They grew up to 3 meters in size. On display at the Sam Noble Oklahoma Museum of Natural History in Norman, OK.', 'For more information on the paleobiology of Coelophysis bauri, consult the comprehensive 2009 paper by Rinehart et al.']",0,1641,11648,194,n/a,https://sketchfab.com/3d-models/coelophysis-c8fee7a21dbc465d8fae98a0df4d190e
Reptilian Shark fossil,Austin Beaulier,"['Reptilian Shark Fossil (Ichthyosaur stenopterygius) \nTaken @HMNS\nBy:Austin Beaulier\nAustinbeaulier.com', 'Created in RealityCapture by Capturing Reality from 140 images in 00h:15m:42s.']",0,1173,4532,84,n/a,https://sketchfab.com/3d-models/reptilian-shark-fossil-be0a02fccec54c10aeec203db4bd3433
Spiclypeus fossil,mikesira,"['Fossil of a Spiclypeus skull.', 'Naturhistorisches Museum Wien', '📍 Volkstheater, Vienna, Vienna, Austria']",0,391,1885,60,n/a,https://sketchfab.com/3d-models/spiclypeus-fossil-fcf4e769772743518a160b8274a9bfc8
Lowpoly Fossils - 2 - Non Commercial,Loïc Norgeot,"['CC-Attribution - Non Commercial', 'A collection of reprocessed fossils (other free assets here), ready to use as game props, particles or for optimized renderings, but “sadly” not for commercial projects as the original scans are licensed under CC Attribution - NonCommercial.', 'Each model is made of 1500 triangles, and 1024 pixels albedo and normal maps.', 'The original scans were first remeshed with mmgs, and decimated, UV unwrapped and baked in blender. Normal maps are ready to use for Unreal Engine, but don’t forget to flip their green channel in Unity!', 'Most of the original scans are from @Fossils_in_Shropshire and @steinkern, other credits to @yuelands, @LapworthMuseum, @ETMNH, , @conqueror78 and @chkalov_urup.', 'All original models licensed under CC attribution - Non Commercial.']",0,3028,10336,449,n/a,https://sketchfab.com/3d-models/lowpoly-fossils-2-non-commercial-67422af7969f478fb99684fe027317fc
Lowpoly fossils - 1,Loïc Norgeot,"['A collection of reprocessed fossils (other free assets here), ready to use as game props, particles or for optimized renderings.  Just don’t pretend they’re yours or try to resell them. Any feedback is welcome!', 'Each model is made of 1500 triangles, and 1024 pixels albedo and normal maps.', 'The original scans were first remeshed with mmgs, and decimated, UV unwrapped and baked in blender. Normal maps are ready to use for Unreal Engine, but don’t forget to flip their green channel in Unity!', 'Original scans from @dennis.brooks, @nebulousflynn, @jim.middleton, @docfx, @raymann, @ilstatemuseum, @uncgimaginglab, @isamedta, @Formwerk3D, @conqueror78, @ETMNH, @alaska_nps_geology, @osuart, @vodzurk, @jeremielouvetz.', 'All original models licensed under CC attribution.']",0,1932,8221,254,n/a,https://sketchfab.com/3d-models/lowpoly-fossils-1-3d1161a5db4244e486de6de0c66f759c
Lariosarus balsami fossil,The Watt Institution,"['A cast, from Robert Ferris Damon, of an almost complete skeleton on (Lariosarus balsami) a small marine dinosaur from 247 - 237 million years ago. The original fossil was in Frankfurt Museum but was destroyed during World War Two.']",0,96,546,22,n/a,https://sketchfab.com/3d-models/lariosarus-balsami-fossil-c1b0e6e5f0b0427480a78f2ca7b5c453
Rainbow morph animation,SenYul,"['This is a free Blender resource I created to encourage people who are just starting out with 3D animation. The basic principles shown here have a wide range of potential uses, from game design, to scientific presentation.', 'Some of the concepts include:', 'For instance, I’ve animated some of my models to demonstrate:', 'Happy modelling / scanning & animating!', '']",0,2428,12231,254,n/a,https://sketchfab.com/3d-models/rainbow-morph-animation-18c96b42cf7d433ca72df475cd6ec4d8
Tyrannosaurus rex - brain endocast - AMNH 5117,WitmerLab at Ohio University,"['We modeled the brain structure of Tyrannosaurus rex by CT scanning a fossilized braincase (AMNH FR 5117) from the collection of the American Museum of Natural History. We segmented the brain cavity and associated internal structures using Avizo, yielding what’s known as a brain endocast. We then cleaned up the model in Maya, tweaked and branded it in Zbrush, and then uploaded it to Sketchfab. Ryan Ridgely did the 3D visualization work, and Witmer and Ridgely published a scientific article on tyrannosaur brain evolution, including this specimen, in 2009 (http://bit.ly/1R8xyHE). An OBJ file can be downloaded here and, if necessary, converted to an STL for 3D printing. Not for commercial use.']",0,669,7937,60,n/a,https://sketchfab.com/3d-models/tyrannosaurus-rex-brain-endocast-amnh-5117-f4303dc6b9df423b809be241f2b73e04
Vertebrate: Coelophysis dinosaur model,Digital Atlas of Ancient Life,"['Metal model of the Late Triassic and Early Jurassic dinosaur Coelophysis on display outside of the Museum of the Earth in Ithaca, New York. 3D model by Emily Hauf.']",0,270,2697,32,n/a,https://sketchfab.com/3d-models/vertebrate-coelophysis-dinosaur-model-e20f6c50d8e34b14bcfdfcd43be7cfdc
"The Red Ravine - Rapa Rosie, Romania",Structural Modelling Group,"['Rapa Rosie is a geological and botanical reserve presenting beautiful erosional features. \nThese continental red-beds are faimous for their dinosaur fossil content (i.e. Codrea et al., 2010 - doi: 10.1016/j.palaeo.2009.10.027).']",0,81,436,13,n/a,https://sketchfab.com/3d-models/the-red-ravine-rapa-rosie-romania-6b3083525dd34344ad15db53adc7fed0
Mosquito in amber,Loïc Norgeot,"['Messing around with refractive materials!', '', 'The Mosquito scan (415k tris) is from Geoffrey Marchal.', 'Modeling:', 'Material:', 'The important parts are the roughness and normal maps, which are a mix of PBR textures (rougher edges, smoother main face), while the refractivity is just a product of tweaking Sketchfab settings: opacity set to refractive and using the object’s roughness.', '']",0,9500,55768,1700,n/a,https://sketchfab.com/3d-models/mosquito-in-amber-53a61d58c09b4d2ab30e269aa3e22078
Dinosaur Skull,bariacg,"['Dinosaur Skull 3d model in cartoon style.       \n3ds max 2020 , FBX and OBJ files     ', 'Clean topology                      \nNon-Overlap UVs                      ', 'Texture include                     \n- Base Color                        \n- Normal                            \n- Roughness                         ', '2048x2048 PNG texture                ', '2,588 poly                          \n2,595 vert                          \nIn subdivision Level 0']",1,n/a,1334,21,$19 ,https://sketchfab.com/3d-models/dinosaur-skull-7c01ac826fe84394bfe4da601bf9a506
Dinosaur Footprint,Professor Dominic Powlesland,"['It appears I wrongly attributed this to a Diplodocus when I first modelled it, I was wrong, it appears it is to be the huge footprint from a Brachiosaurus. \nA single Dinosaur footprint measuring 0.9 metres across near  Purbeck, Dorset. A series of small impressions c.10cm across running around the edge have been interpreted as the footprints of an infant dinosaur.', 'This model was created to secure a detailed an precise 3D record of the footprints which could be shared around the world. To read more about the footprints follow this link http://www.landscaperesearchcentre.org/wp/?p=113']",0,119,3415,14,n/a,https://sketchfab.com/3d-models/dinosaur-footprint-0d1a34d4b027443f805aae6b83e75c5b
Triceratops,DailyArt,"['A genus of herbivorous dinosaurs of the subfamily ceratophoridae, found in the late Cretaceous late Maastrichtian strata of North America, about 68 million to 65 million years ago. Triceratops, one of the latest dinosaurs, are often regarded as the representative fossils of the late Cretaceous. At present, there are two effective species: Triceratops and Triceratops, but other genera have been named. Triceratops are also one of the most famous dinosaurs. They are also very popular in popular culture.']",0,5821,21276,425,n/a,https://sketchfab.com/3d-models/triceratops-909bf645de1746829ab19acd1ae31767
Juvenile Triceratops Fossil,PhotoGramGear,"['From the Triceratops Horridus family.\nReprocessed an old set of photos, then baked and reduced it down to a realtime asset.']",1,n/a,1861,35,$25 ,https://sketchfab.com/3d-models/juvenile-triceratops-fossil-51b6e27147b043ef9fb266a7cda57e35
Dinosaur Skull (Untextured),LingthyManThatExists,"['It’s a dinosaur skull. Specifically a T-Rex skull. (Model from the Paint 3D Library, i do not own anything in this model.)']",0,111,409,15,n/a,https://sketchfab.com/3d-models/dinosaur-skull-untextured-30be129238814c6cb8db39c82d3cee07
Fossil Dinosaur Bone,MADD Designs,['An unkown dinosaur fossil bone.Found in the Dakota Badlands.\nPossiby a partial hadrosaur vertebre.\nMeasures  7” X 6” X 4” And Weighs 6 LBS 13 OZ'],1,n/a,115,1,$4.99 ,https://sketchfab.com/3d-models/fossil-dinosaur-bone-3f6713593072415db845adfab1618968
Tyrannosaurus Fossil,mtaesiri,['The Royal Tyrrell Museum of Palaeontology'],0,56,256,8,n/a,https://sketchfab.com/3d-models/tyrannosaurus-fossil-54b0956c5a6342cebc37852d801890e2
Zuniceratops Fossil,PhotoGramGear,"['Similiar to the triceratops the zuniceratops that had soft tissue on its head and was much smaller than average at around 2.2 meters in length. Zuniceratops is an example of the evolutionary transition between early ceratopsians and the later, larger ceratopsids that had very large horns and frills. This supports the theory that the lineage of ceratopsian dinosaurs may have been North American in origin.']",1,n/a,876,16,$55 ,https://sketchfab.com/3d-models/zuniceratops-fossil-62fd20bbf23c4b848192bb942f991c03
Mosasaur Fossil,ESUEarthSci,"['A description about this fossil, which is located in  the Johnston Geology Museum at Emporia State University:\nThis specimen was collected during the summer of 1967 two miles north of Elkader, KS, in SW Gove Co. It was found by a groupd of elementary teachers while on a field trip to Western KS as part of a science enrichment program under the auspices of the Flint Hills Elementary Science Project funded by the U.S. Office of Education, Department of Health, Education, and Welfare.\nMosasaurs were elongate, lizard-like reptiles that were fully adapted for marine life. A snake like characteristic is seen in the structure of the jaw which is held to the skull by ligaments only. This gave freedom of movement at the back of the jaw and assisted in  swallowing large objects.....\nPart of the Cretaceous.', 'Background photo found at: https://phys.org/news/2018-10-ancient-fish-evolved-shallow-seas.html']",0,127,1177,15,n/a,https://sketchfab.com/3d-models/mosasaur-fossil-0e33035bf91748f39d8a261a31cc22da
Ancient Rhino Fossil,Austin Beaulier,"['I forgot to get a picutre of the info :(', 'taken at the houston museum on natural science\nhmns.org', 'taken by \naustinbeaulier.com']",0,596,2292,45,n/a,https://sketchfab.com/3d-models/ancient-rhino-fossil-625d1672538240e994fb4dcc80a493db
Dinosaur Bones,Tom Johnson,"['this model is decimated and polypainted but no retopo/textures yet.', 'see more of my work on my website and instagram:', 'https://www.tomjohnsonart.co.uk/', 'https://www.instagram.com/tomjohnsonart/']",1,n/a,441,18,$60 ,https://sketchfab.com/3d-models/dinosaur-bones-1c8a498dc5aa4240b8955e1d469dcf8d
Trilobite Fossil Photogrammetry Scan,Austin Beaulier,"['Trilobites are a fossil group of extinct marine arachnomorph arthropods that form the class Trilobita. Trilobites form one of the earliest known groups of arthropods', 'Taken by Austin Beaulier']",0,270,1352,20,n/a,https://sketchfab.com/3d-models/trilobite-fossil-photogrammetry-scan-477033de933143009660bb72e6f3c6fd
Velociraptor Fossil,Polygon Artisan,"['Velociraptor Fossil, ready for 3d printing.']",1,n/a,726,7,$8 ,https://sketchfab.com/3d-models/velociraptor-fossil-bde607338c1d4b1fa5b85db36cfbd87e
Xiphactinus Audax Fossil Skull,Free 3D Models,['XIPHACTINUS AUDAX Fossil Skull photogrammetry model.  More models:  -link removed-'],0,149,750,17,n/a,https://sketchfab.com/3d-models/xiphactinus-audax-fossil-skull-9f26fe5bc6be4ee790283c9d22df7cb3
DINOSAUR FOSSIL EDMONTOSAURUS FEMUR,Free 3D Models,"['“Edmontosaurus Femur” ', 'Huge Specimen', 'Really nice quality bone patina.  A real treat of a specimen.', 'The Duck Billed Dinosaur Edmontosaurus compared in size to Tyrannosaurus Rex', 'There was a piece of the end bone still connected, but separated from the bone by matrix.']",0,45,273,1,n/a,https://sketchfab.com/3d-models/dinosaur-fossil-edmontosaurus-femur-0465a4f71f144736a369909c638d7351
ERLIKOSAURUS SKULL AND JAW,ramon.gonzalez.cabrera,"['Erlikosaurus is a genus of herbivorous theropod dinosaur from the late Cretaceous Period, belonging to the Therizinosauridae. Its fossils, \n were found in the Bayan Shireh Formation of Mongolia, dating to around 90 million years ago.\nCitations:Lautenschlager S (2015) Estimating cranial musculoskeletal constraints in theropod dinosaurs. Royal Society Open Science 2: 150495. http://dx.doi.org/10.1098/rsos.150495\nLautenschlager S (2015) Data from: Estimating cranial musculoskeletal constraints in theropod dinosaurs. Dryad Digital Repository. http://dx.doi.org/10.5061/dryad.c75j9.\nThanks to S. Lautenschlager (http://eis.bris.ac.uk/~glzsl/home.html )and to  http://datadryad.org/ for sharing the original file.', 'For curious people.\nhttps://www.youtube.com/watch?v=HFlXcxiIZFU']",0,731,3897,102,n/a,https://sketchfab.com/3d-models/erlikosaurus-skull-and-jaw-dd9df0256dc642a1a2a56775805a36bf
Dinosaur Compy LowPoly Art,Oleg Shuldiakov,['Dinosaur Compy LowPoly Art'],1,n/a,270,10,$29 ,https://sketchfab.com/3d-models/dinosaur-compy-lowpoly-art-92099fe9e6dd4c378068ae3a616b4ed1
Hoplophoneus skull - miniature sabertooth cat,Badlands Dinosaur Museum,"['Skull of the miniature “false sabertooth cat” Hoplophoneus sp.: one of the top predators of the US Great Plains  ~30 million years ago in the Oligocene Epoch. It belonged to the Nimravidae which were closely related to cats, but not a “true” cat, having shorter, stockier legs & a shorter tail', 'Giant saber teeth (actually modified canines) have evolved a number of times in cat-like mammals and are thought to have been used to deliver a fast, precise bite to the neck, severing major blood vessels and causing death through loss of blood. Living big cats (like lions) have short, stout, canines, and kill by crushing the windpipe of their prey, causing death by asphyxiation', 'Scanned from an original fossil skull held in the collection of Badlands Dinosaur Museum, Dickinson Museum Center, Dickinson North Dakota. A public museum & registered non-profit:', 'http://dickinsonmuseumcenter.com/', 'File prepared by museum staff. Scan by A. Hendrix; optimized by D. Fowler. Created using a Revopoint Pop2 scanner']",0,474,2632,71,n/a,https://sketchfab.com/3d-models/hoplophoneus-skull-miniature-sabertooth-cat-72e99ed620104dc180cc376b8dad0e84
Edmontosaurus fossil skull,The_Model_Guy2.3,['Edmontosaurus skull'],0,89,448,17,n/a,https://sketchfab.com/3d-models/edmontosaurus-fossil-skull-92715619fb2b44849af36da71457ec15
3DRT Dinosaurs - Compsognathus,3DRT.com,"['Compsognathus - 1852 tris.\n1024x1024 .jpg textures. \nDiffuse, normal and specular maps included.\n22 animations:', '0-5 stand_pose\n10-160 idle_01\n170-400 idle_02\n410-710 idle_03\n720-890 idle_eat\n900-940 walk\n950-1000 walk_back\n1010-1030 run_fast\n1040-1060 run\n1070-1110 turn_right\n1120-1160 turn_left\n1170-1250 death\n1260-1300 attack_01\n1300-1360 attack_02\n1360-1420 head kick\n1420-1460 roar\n1470-1570 injured\n1580-1700 surprised\n1710-1810 sleep\n1820-1850 yes\n1850-1880 no\n1880-1900 ducking']",1,n/a,2441,21,$29 ,https://sketchfab.com/3d-models/3drt-dinosaurs-compsognathus-bb1b5ba717b8446db16700f4b0663402
Euoplocephalus - armored dinosaur - airway/brain,WitmerLab at Ohio University,"['This model is of the armored ankylosaurian ornithischian dinosaur Euoplocephalus tutus (AMNH FR 5405), showing the skull transparent to reveal the internal nasal passage and brain endocast. The main airway (yellow) loops through the snout (arrow); the large olfactory area (magenta) is in the back of the nasal cavity. The fossil was CT scanned at OhioHealth O’Bleness Hospital in Athens, Ohio, in 2005 as part of a research project, leading to publications in 2008 (http://bit.ly/2pp5V5C) and 2011 (http://bit.ly/2rCNCsT). This Sketchfab model was generated by Ryan Ridgely of WitmerLab and is derived from recent work done for the Smithsonian’s National Museum of Natural History for a new interactive exhibit. This research was funded in part by U.S. National Science Foundation grants to Witmer and Ridgely, and by the Ohio University Heritage College of Osteopathic Medicine.']",0,137,1824,18,n/a,https://sketchfab.com/3d-models/euoplocephalus-armored-dinosaur-airwaybrain-d88f5930107a4c84a9b2b714a2dfa20a
Dinosaur - Amber T-Rex - Sculpture,PTM Models,"['Gold Resin Sculpture : T-Rex', '3D Gold & Epoxy Resin Sculpture', 'Perfect For: ', 'This model includes 8K Resolution Texture Maps;  Incredible & realistic detail.', '–> COME GET MORE ON MY PAGE !!!']",0,198,1269,55,n/a,https://sketchfab.com/3d-models/dinosaur-amber-t-rex-sculpture-0fab02fe9a124c27879689e7c46f5557
Triceratops Baby Dinosaur Reptile,Nyilonelycompany,"['Triangles -12163\nFaces -6652\nEdges -12765\nVertices -6123', 'Diffuse, Metallic, Roughness , Normal Map ,Specular Map,AO', 'Triceratops is a genus of chasmosaurine ceratopsian dinosaur that lived during the late Maastrichtian age of the Late Cretaceous period, about 68 to 66 million years ago in what is now western North America. \nEats: Cycads, Palms\nFossils: Yoshi’s Trike, Raymond, AMNH 5039, Kelsey, Hatcher\nLived: 83.5 million years ago - 66 million years ago (Campanian - Maastrichtian)']",1,n/a,277,12,$50 ,https://sketchfab.com/3d-models/triceratops-baby-dinosaur-reptile-1497a9bb99a84ed9be4de89457607217
