Title,Publisher,Description,Paid,Downloads,Views,Likes,Price,Link
Tyrannosaurus Rex 4.0,3dartstevenz,"['This Trex was sculpted in zbrush, textured in Substance Painter and Photoshop, rigged and animated in blender. Textures png 4096x4096.', 'Tyrannosaurus is a genus of large theropod dinosaur. The species Tyrannosaurus rex (rex meaning king in Latin), often called T. rex or colloquially T-Rex, is one of the best represented theropods. Tyrannosaurus lived throughout what is now western North America, on what was then an island continent known as Laramidia. Tyrannosaurus had a much wider range than other tyrannosaurids. Fossils are found in a variety of rock formations dating to the Maastrichtian age of the Upper Cretaceous period, 68 to 66 million years ago. It was the last known member of the tyrannosaurids and among the last non-avian dinosaurs to exist before the Cretaceous–Paleogene extinction event.']",1,n/a,912,11,$19.99 ,https://sketchfab.com/3d-models/tyrannosaurus-rex-40-ce5321ddccbb4d839f0e06bf36b6047a
The armoured extinct mammal Panochthus,EDDyLab @ULiege,"['(Fr)', 'Les glyptodontes sont des cousins éteints des tatous et constituent l’un des rares groupes de mammifères placentaires qui a évalué en Amérique du Sud avant la formation de l’Isthme de Panama. Les glyptodontes possédaient une armure osseuse et une massue caudale, qui sont convergentes avec les ankylosaures (dinosaures).', 'Ce spécimen est un moulage qui provient des collections de paléontologie animale de l’Université de Liège, Belgique http://eddylab.weebly.com/collections.html', '———————————————', '(En)', 'Glyptodonts are extinct relatives of armadillos and one of the rare placental mammal clades that evolved in South America prior to the existence of the Isthmus of Panama. Glyptodonts evolved a bony armor and spiked tail clubs that are convergent with ankylosaurid dinosaurs. ', 'This specimen ULg PA 1468 is a cast housed in the collections of Fossil Animals at the Université de Liège, Belgium http://eddylab.weebly.com/collections.html']",0,243,1532,32,n/a,https://sketchfab.com/3d-models/the-armoured-extinct-mammal-panochthus-c35f524bb29c432bbcf6b8c1e5198fdb
Yet Another Rex skull,MikeBG,['Tyrannosaurus skull custom built based on references like Witmer at Ohio State.'],1,n/a,3355,33,$45 ,https://sketchfab.com/3d-models/yet-another-rex-skull-eb9302e41f204cbb9703f4c24b1a5bc3
A spiny ammonite,EDDyLab @ULiege,"['(Fr)', 'Voici une ammonite du genre Acanthoceras, du Crétacé supérieur du Mans (France). Les ammonites sont des mollusques céphalopodes, comme les seiches et le nautile. Cependant, les ammonites ont complètement disparus des écosystèmes marins il y a 66 millions d’année, durant la même extinction de masse qui a couté la vie à la plupart des dinosaures de cette période!', 'Ce spécimen, ULg PA 3103, provient des collections de Paléontologie Animales de l’Université de Liège, Belgique http://eddylab.weebly.com/collections.html', '========', '(En)', 'Here is an ammonite of the genus Acanthoceras from the Late Cretaceous of Le Mans. Ammonites are cephalopod molluscs, like cuttlefish and Nautilus. However, ammonites completely disappeared from marine ecosystems 66 million years ago, during the same mass extinction that claimed the lives of most dinosaurs of the time!', 'This specimen, ULg PA 3103, is housed in the collections of Fossil Animals at the Université de Liège, Belgium http://eddylab.weebly.com/collections.html']",0,156,610,15,n/a,https://sketchfab.com/3d-models/a-spiny-ammonite-69762763d05f4be19849b5d6024e282a
Sinovenator changii IVPP V20378,Pomona Pictures,['From the excellent paper by Yu et al https://www.nature.com/articles/s42003-024-05832-3'],0,11,96,12,n/a,https://sketchfab.com/3d-models/sinovenator-changii-ivpp-v20378-2ccee430415a4c71b5f31ba67156bbd4
Citipati osmolskae,Pomona Pictures,"['Have alwasy been fascinated by how intricate oviraptorid skulls are.\nData courtesy of Digimorph http://digimorph.org\nDr. James Clark, Dr. Mark A. Norell and Dr. Timothy Rowe, 2002, “Citipati osmolskae” (On-line), Digital Morphology. Accessed September 11, 2021 at http://digimorph.org/specimens/Citipati_osmolskae/']",0,157,944,24,n/a,https://sketchfab.com/3d-models/citipati-osmolskae-d6d0736d2077475d84f617cc96e9f330
Ankylosaurus Scute Cast 3D Scan,Laser Design,['3D Scan of Ankylosaurus Scute / Plate fossil cast. 3D scanned with Artec Space Spider 3D scanner. Time to scan: About 2 minutes. Time to process into full color model: about 15 minutes.'],0,37,126,7,n/a,https://sketchfab.com/3d-models/ankylosaurus-scute-cast-3d-scan-f2c73d314c9347c998be519d65ab2d3d
Real-time Refraction Demo: Mosquito in Amber,Sketchfab,"['Refraction is the phenomenon that makes light bend when passing through different transparent materials due to the velocity of light changing in different media. It makes objects behind the refractive material look distorted. Refraction is useful for simulating glass, gemstones, and many other transparent materials. Real-time refraction is available on all plans, including Basic - learn how to use it on our Help Center.\n\nOriginal model ‘Mosquito in amber‘ published by Loïc Norgeot\n under a Creative Commons Attribution license.']",0,3577,30705,782,n/a,https://sketchfab.com/3d-models/real-time-refraction-demo-mosquito-in-amber-37233d6ed84844fea1ebe88069ea58d1
Spinosaurus,Gomizard,"['A model of an Spinosaurs Based on the new fossil discoveries (shorter legs, wider tail and that veil form). Good for using in any Dinosaur game or for practicing animation.\n11.006 Faces.\nRigged and with 2 animations: walking and walking roar. The rig is totally functional and you will be able to create new animations.\nIt also has an extra albedo map so you can change the texture to look like the Jurassic Park 3 Spinosaurus. You can watch this texture in my instagram @Gomizard_art.\n  As extra file, theres a Blender file with the model ready to animate.']",1,n/a,1075,10,$8 ,https://sketchfab.com/3d-models/spinosaurus-b47534b995c14d5789905f481c50760d
Juvenile tyrannosaurus,MikeBG,['A custom “Jane” type juvenile tyrannosaurus skull. It was formerly called nanotyrannus when it was thought to be a dwarf species of tyrannosaurus.'],1,n/a,853,25,$65 ,https://sketchfab.com/3d-models/juvenile-tyrannosaurus-2fb5178065c14a72b7123f430ecee53a
Euplocephalus Skull,dinosaurhunter,['Isolated from CT scans of an AMNH specimen.'],0,33,217,6,n/a,https://sketchfab.com/3d-models/euplocephalus-skull-c7053685b14c4a1281e1939eb5f544aa
Hadrosaur track with leaves highlighted,Denali National Park and Preserve,"['Hadrosaurs, also called duck-billed dinosaurs, roamed Denali National Park in large herds ~70 million years ago during the Cretaceous Period. This track was made when a herbivorous hadrosaur walked through the mud near a river bank and stepped on fallen leaves. Through time the track and leaves were compacted, cemented, and preserved as fossils in the Cantwell Formation. Not all plant fossils that can be seen on this track have been highlighted or annotated. This 3-D fossil image is available courtesy of Denali National Park and Preserve.']",0,33,1280,7,n/a,https://sketchfab.com/3d-models/hadrosaur-track-with-leaves-highlighted-3d463f0054a546f181683cae760df238
Crystal Palace Iguanodon,NHM_Imaging,"['A scale model in bronze showing the life-size Iguanodon statue erected in Crystal Palace Park, London, in 1853-1855. The models were probably made by sculptor Benjamin Waterhouse Hawkins.', 'The species that the Iguandon statues were based on has since been renamed Mantellodon (meaning ‘Mantell’s tooth’) after the famous scientist Gideon Mantell who described their fossil remains.', 'For more information, see https://cpdinosaurs.org/visit/statue-details/iguanodon.']",0,259,2351,38,n/a,https://sketchfab.com/3d-models/crystal-palace-iguanodon-6bc7692c83cb407d87a868be7e1e82fc
Zanabazar junior,Pomona Pictures,"['Original scan courtesy of Digimorph http://digimorph.org\nDr. Mark Norell, P.J. Makovicky, G.S. Bever, A.M. Balanoff, J.M. Clark, R. Barsbold and T. Rowe, 2009, “Zanabazar junior” (On-line), Digital Morphology. Accessed September 11, 2021 at http://digimorph.org/specimens/Zanabazar_junior/']",0,95,467,20,n/a,https://sketchfab.com/3d-models/zanabazar-junior-b6c56ec9b33d41a087580bc3752f5df3
T-Rex Partial Lower Jaw,MADD Designs,"['A photoscanned partial Tyrannosaurus Jaw.', 'from the plaque: “Jawbone of the powerful Tyrannosaurus Rex.\nA dinosaur that was 47 feet long and weighed five tons, and\nwould have liked to eat you alive.”', 'Displayed at Red Rocks Amphitheater, Morrison, CO.']",1,n/a,215,6,$6.99 ,https://sketchfab.com/3d-models/t-rex-partial-lower-jaw-7ec4334a13c044e4990e1c9f1be02531
Horseshoe Crab Fossil,Will H,['Simple low poly horseshoe crab fossil.'],0,17,104,0,n/a,https://sketchfab.com/3d-models/horseshoe-crab-fossil-ffeae8a50c444f67a6a31ba1c18b29d2
Tooth crown of Mosasaurus hoffmannii,EDDyLab @ULiege,"['(Fr)', 'Voici la couronne d’une dent de Mosasaurus hoffmannii, un très grand mosasaure prédateur qui vivait dans la région de Liège il y a plus de 67 millions d’années. Les mosasaures étaient des reptiles marins de l’époque des dinosaures.', 'Ce spécimen, ULg PA 25119a_020, provient des collections de paléontologie animale de l’Université de Liège http://eddylab.weebly.com/collections.html', '———————————————', '(En)', 'Here is the tooth crown of Mosasaurs hoffmannii, a large predatory mosasaur that swam in eastern Belgium more than 67 million years ago. Mosasaurs were marine reptiles that lived during the dinosaur Era.', 'This specimen, ULg PA 25119a_020, is housed in the collections of Fossil Animals at the Université de Liège http://eddylab.weebly.com/collections.html']",0,297,1027,20,n/a,https://sketchfab.com/3d-models/tooth-crown-of-mosasaurus-hoffmannii-1df3db41a81449838334070de82fafc8
Bakonydraco galaczi mandibular symphysis,Hungarian Dinosaur Expedition,"['Bakonydraco galaczi (MTM 2010.74.4) (Pterosauria, Azhdarchidae) mandibular symphysis, \nfrom the Upper Cretaceous (Santonian) Csehbánya Formation (Iharkút, Hungary). ', 'Bakonydraco galaczi (MTM 2010.74.4) (Pterosauria, Azhdarchidae) mandibularis symphysis, \nmely Iharkútról, a késő-kréta (santoni) korú Csehbányai Formáció rétegeiből került elő.', 'For more information about Bakonydraco, see: \nhttps://magyardinoszaurusz.hu/bakonydraco-galaczi/?lang=en', 'További információk a Bakonydracoról: \nhttps://magyardinoszaurusz.hu/bakonydraco-galaczi/', 'Digitized by Martin Segesdi / A modellt készítette: Segesdi Martin', '-', 'A Polyga Compact S1 surface scanner (0.04 mm accuracy) with FlexScan3D software was used for digitization in three dimensions. Raw model was treated with Geomagic Wrap (3D Systems, https://www.3dsystems.com).']",0,18,105,4,n/a,https://sketchfab.com/3d-models/bakonydraco-galaczi-mandibular-symphysis-c465d96f14d3471598314ba63996d403
Juvenile T-rex high poly,MikeBG,"['This is a higher poly version of the juvenile tyrannosaurus (nanotyrannus). No normal, bump, or displacement maps.']",1,n/a,989,19,$70 ,https://sketchfab.com/3d-models/juvenile-t-rex-high-poly-27e871b39b3648d7ae9d05e90ea4a6c0
Crocodile Braincase,Badlands Dinosaur Museum,"['This fossilized braincase was collected from the Judith River Formation in Montana, from US public lands administered by the Bureau of Land Management. \n~77mya', 'Scanned using a Revopoint MINI']",0,9,165,4,n/a,https://sketchfab.com/3d-models/crocodile-braincase-094e4844a97f431393bda29a35aba592
Spinosaurus aegyptiacus Skeleton,Iofry,"['Skeleton partially based on the skeletal by GetAwayTrike of the paper by David W.E. Hone and Thomas R. Holtz, Jr. The skull and neck bones are partially based on Marco Auditore skeletal.']",1,n/a,4502,60,$26 ,https://sketchfab.com/3d-models/spinosaurus-aegyptiacus-skeleton-b014de567a354019a5079b4796894655
Spinosaurus aegyptiacus Skeleton,Iofry,"['Skeleton partially based on the skeletal by GetAwayTrike of the paper by David W.E. Hone and Thomas R. Holtz, Jr. The skull and neck bones are partially based on Marco Auditore skeletal.']",1,n/a,4502,60,$26 ,https://sketchfab.com/3d-models/spinosaurus-aegyptiacus-skeleton-b014de567a354019a5079b4796894655
maiasaura,seth the yutyrannus,"['Maiasaura, (genus Maiasaura), duck-billed dinosaurs (hadrosaurs) found as fossils from the Late Cretaceous Period (about 100 million to 65.5 million years old) of North America and whose discovery led to the theory that these bipedal herbivores cared for their young.', 'In 1978 a Maiasaura nesting site was discovered in the Two Medicine Formation near Choteau, Montana, U.S. The remains of an adult Maiasaura were found in close association with a nest of juvenile dinosaurs, each about 1 metre (3.3 feet) long. Hatchlings that were too large (about 0.5 metre long) to fit into eggs, and nests with clutches of eggs, as well as many broken eggshells, were found nearby. The bones of the embryos, however, were not fully ossified, which means the young could not have walked immediately upon hatching and would have required some degree of parental care. Hundreds of skeletons preserved in one specific ashbed in Montana, as well as those preserved in nesting sites, suggest that Maiasaura was migratory.']",0,33,187,8,n/a,https://sketchfab.com/3d-models/maiasaura-4b381d9d0c5746b684143e0bf19b6d1d
"Dinosaur Statue - Haddonfield, NJ",Jake Steinerman,"['In October 2003, a statue was erected in downtown Haddonfield commemorating the World’s First Dinosaur Skeleton Discovery in October, 1858. The Hadrosaurus foulkii was the first nearly complete dinosaur skeleton found, and the first to be mounted for public display (partial skeletons and fossils were discovered earlier in England, where the term “dinosaur” was coined in the 1820s). The Haddonfield find sparked the start of the field of dinosaur paleontology, and can probably be blamed for the profusion of life-size dinosaur statues across America.', 'https://www.roadsideamerica.com/story/11155', '📍 39.89700, -75.03450']",0,20,143,0,n/a,https://sketchfab.com/3d-models/dinosaur-statue-haddonfield-nj-960b0cb34b1b4e349aec5bc6e328e91a
T-Rex Tooth Cast 2 3D Scan,Laser Design,['3D Scan of T-Rex Tooth 2 fossil cast. 3D scanned with Artec Space Spider 3D scanner. Time to scan: About 2 minutes. Time to process into full color model: about 15 minutes.'],0,35,104,7,n/a,https://sketchfab.com/3d-models/t-rex-tooth-cast-2-3d-scan-a50fb709ac9c4a80897e9c6a1ad4d111
Spinosaurus Tooth,ex_natura,['Large Spinosaurus tooth from the Kem Kem beds'],0,339,1256,16,n/a,https://sketchfab.com/3d-models/spinosaurus-tooth-dcd10af830824313ac1836eef8518ccd
Ceoloyphysis,robertfabiani,"['Coelophysis, a nimble and early theropod dinosaur from the Late Triassic, takes us on a journey to the dawn of the age of dinosaurs. Hailing from what is now North America, this agile predator played a pivotal role in shaping the diverse ecosystems of its time.', 'With its slender frame and swift movements, Coelophysis was an adept hunter, preying on small vertebrates and insects. Fossil discoveries, including mass burial sites, provide a glimpse into its social behavior, suggesting that Coelophysis may have lived and hunted in groups.', 'Step into the ancient Triassic landscapes with Coelophysis, a pioneer of the dinosaur lineage. Explore the mysteries of early dinosaur life with']",1,n/a,95,3,$39 ,https://sketchfab.com/3d-models/ceoloyphysis-012c3c65126a44eca76eeff64590d203
Podokesaurus Holyokensis,trickfilm,"['Massachusetts State Dinosaur Podokesaurus Holyokensis, scanned by Luke Jaeger at the Fimbel Maker &amp; Innovation Lab, Mt Holyoke College']",0,15,124,2,n/a,https://sketchfab.com/3d-models/podokesaurus-holyokensis-dcf2ad58a9d2472188dfa458d4cead04
SPINOSAURUS TOOTH,jesusmolina,"['Fotogrametric model of Spinosaurus tooth fossil', 'Spinosaurus aegyptiacus was a huge carnivore, weighing in at over 8 tons, and likely bigger than the famous T.rex. It had a long, crocodilian snout filled with these pointed spike-like teeth. It is thought that it may have fed by wading through rivers and tidal zones swiping fish.']",0,99,403,8,n/a,https://sketchfab.com/3d-models/spinosaurus-tooth-2d13203c065e437981ef86d5a61b5138
"Track 2 - Picketwire, CO",Shellie Luallin,"['Picketwire Canyon is in Las Animas County, Colorado on the Purgatoire River and is home to thousands of dinosaur tracks.']",1,n/a,51,2,$3.99 ,https://sketchfab.com/3d-models/track-2-picketwire-co-b9299f7302b7447f9b68ee6c979222e3
Tyrannosaurus Rex 4.2,3dartstevenz,"['This Trex was sculpted in zbrush, textured in Substance Painter and Photoshop, rigged and animated in blender. ', 'Textures png 4096x4096.', '7 animations: run cycle, walk cycle, walk + roar, walk left, walk right, roar, waiting', 'Tyrannosaurus is a genus of large theropod dinosaur. The species Tyrannosaurus rex (rex meaning king in Latin), often called T. rex or colloquially T-Rex, is one of the best represented theropods. Tyrannosaurus lived throughout what is now western North America, on what was then an island continent known as Laramidia. Tyrannosaurus had a much wider range than other tyrannosaurids. Fossils are found in a variety of rock formations dating to the Maastrichtian age of the Upper Cretaceous period, 68 to 66 million years ago. It was the last known member of the tyrannosaurids and among the last non-avian dinosaurs to exist before the Cretaceous–Paleogene extinction event.']",1,n/a,1061,10,$19.90 ,https://sketchfab.com/3d-models/tyrannosaurus-rex-42-1105ddbae5dc4b72a3821e740459052a
T-Rex Broken Tooth 3D Scan,Laser Design,['3D Scan of Brokne T-Rex Tooth fossil cast. 3D scanned with Artec Space Spider 3D scanner. Time to scan: About 2 minutes. Time to process into full color model: about 15 minutes.'],0,23,65,6,n/a,https://sketchfab.com/3d-models/t-rex-broken-tooth-3d-scan-55f72a00e17c46c1901eda78eb957a2f
Baby Parasaurolophus Skeleton,Olof Moleman,"['Surface scan of the skeleton of the baby Parasaurolophus Joe. The original scan is from the open access paper that described this specimen. I have edited the scan to make it printable. The file is scaled at 1/5th of life size.', 'The original publication and scan files can be found here:\nFarke, A. A., D. J. Chok, A. Herrero, B. Scolieri, and S. Werning. 2013. Ontogeny in the tube-crested dinosaur Parasaurolophus (Hadrosauridae) and heterochrony in hadrosaurids.\nhttps://peerj.com/articles/182', 'Specimen website: https://www.dinosaurjoe.org', 'Museum website: https://www.alfmuseum.org']",0,177,961,15,n/a,https://sketchfab.com/3d-models/baby-parasaurolophus-skeleton-18de87dd270f478bbbeb310cd514cc00
The dino formerly know as Syntarsus kayentakatae,Pomona Pictures,"['Syntarsus kayentakatae is known only from Early Jurassic aged rocks (roughly 200 million years old) of northern Arizona. It was a relatively small theropod, around two and a half to three meters long.\nDr. Ron Tykoski, 2001, “Syntarsus kayentakatae” (On-line), Digital Morphology. Accessed April 30, 2023 at http://digimorph.org/specimens/Syntarsus_kayentakatae/\nbut name not valid anymore apparently\nhttps://en.wikipedia.org/wiki/Coelophysis%3F_kayentakatae']",0,32,229,12,n/a,https://sketchfab.com/3d-models/the-dino-formerly-know-as-syntarsus-kayentakatae-acdc80e6a17246a6a1709f5b4cdb7e18
Karaurus 3D print,RickStikkelorum,"['The oldest known amphibian from the fossil record. Karaurus lived during the jurassic period.', 'Size: 17 centimeters. ', 'Files:\n - 1 obj\n - 170 mm stl\n - 200 mm stl\n - 170 mm stl (with a shorter tail)', 'Recommended 3D print technique:\nSLA']",1,n/a,431,14,$5 ,https://sketchfab.com/3d-models/karaurus-3d-print-fb3901605d154523914df0bcdf5b4aac
Callibrachion Gaudryi,Geoffrey Marchal,"['Callibrachion Gaudryi, Autin (France). Museum of Natural Sciences, Brussels, Belgium. Made out 190 pictures with Capturing Reality.', 'Callibrachion is an extinct genus of caseasaur. It was at least 1.5 metres (5 ft) in length. It lived during the Early Permian. It was originally described in 1893 on a basis of a specimen Early Permian deposits in northeastern France. It was later considered a synonym of Haptodus by several authors, but subsequent examination has found it be a caseid rather a sphenacodont. This was confirmed by cladistic analysis, which recovered Callibrachion as a basal caseid.', 'For more updates, please consider to follow me on Twitter at @GeoffreyMarchal. (https://twitter.com/GeoffreyMarchal)']",1,n/a,916,32,$3.99 ,https://sketchfab.com/3d-models/callibrachion-gaudryi-9155f87202644d549358de71506a169d
Corythosaurus casuarius,Olof Moleman,"['Detailed digital sculpture of the skull of the lambeosaurine hadrosaur Corythosaurus casuarius. ', 'Based mainly on the holotype.']",1,n/a,1846,34,$24 ,https://sketchfab.com/3d-models/corythosaurus-casuarius-8147714eca384feb8f3b33068ff362e8
Olorotitan arharensis Skull,Olof Moleman,"['Reconstructed skull sculpture of an Olorotitan arharensis. Olorotitan is a lambeosaurine hadrosaur from the Late Cretaceous of the Udurchukan Formation in far eastern Russia.', 'Реконструированная скульптура черепа Olorotitan arharensis. Олоротитан — ламбеозавриновый гадрозавр из позднемелового периода удурчуканской свиты на Дальнем Востоке России.']",1,n/a,1354,32,$25 ,https://sketchfab.com/3d-models/olorotitan-arharensis-skull-242b7d607cf04f72b28062dabefa4ddc
Gastropod Shells,Natural History Museum Vienna,"['First islands of what would later form the Alps started to emerge during the Late Cretaceous – some 80 million years ago – from the Tethys Ocean. Swamp forests and salt marshes formed on these islands in which small dinosaurs, such as Struthiosaurus austriacus, roamed. Many gastropods lived in these swamps that where preserved, and formed into these fossils. ', 'This rock is now on display in the newly designed Hall 6 of the NHM Vienna.', 'Specimen:  Shells of the gastropod Trochactaeon giganteus', 'Collection: Natural History Museum Vienna, Geology & Paleontology Dept. (curator: Mathias Harzhauser)', 'Origin: Gosau, Austria', 'Find out more about the NHMW here.', 'Scanned and edited by Viola Winkler & Anna Haider (NHMW)', 'Scanner: Artec Leo. Infrastructure funded by the FFG.']",0,49,265,23,n/a,https://sketchfab.com/3d-models/gastropod-shells-9b4c1b99c1304023884a0e2efbd61c27
Cranio de Alossauro,GeoHereditas,"['Réplica de fóssil de cranio de Alossauro, parte do acervo do Museu de Geociências da Universidade de São Paulo.']",0,88,370,11,n/a,https://sketchfab.com/3d-models/cranio-de-alossauro-c18a2289335f4787bfc128294eccff91
Raptor Claw,Yanez Designs,"['Velociraptor, like other dromaeosaurids, had a large manus (‘hand’) with three strongly curved claws, which were similar in construction and flexibility to the wing bones of modern birds. The second digit was the longest of the three digits present, while the first was shortest.', 'Info Link: https://en.wikipedia.org/wiki/Velociraptor', 'I have a Patreon Join now! :https://www.patreon.com/user?u=14434838']",0,1846,2979,51,n/a,https://sketchfab.com/3d-models/raptor-claw-d7de938402094c88a1e2e99beafe4f77
Mollusc fossils in sandstone,tomstevenson,"['A block of sandstone containing numerous cone-shaped shell fossils, which look similar to unicorn horns. They are 60-64 million years old, and therefore date from a time soon after the extinction of the dinosaurs.', 'This model was constructed from photographs of a real specimen from Mitchell’s Rocks, New Zealand, using the program Agisoft Metashape.']",0,7,32,0,n/a,https://sketchfab.com/3d-models/mollusc-fossils-in-sandstone-239be552ce814d7f9e8dad9f9f23a611
Crushed Tyrannosaur Tooth in Matrix,rankinstudio,"['A crushed Tyrannosaur tooth still in matrix from a quarry in Grand Staircase Escalante National Monument. GSENM collections.', '118 photos shot with Sony RX100IV.']",0,36,213,8,n/a,https://sketchfab.com/3d-models/crushed-tyrannosaur-tooth-in-matrix-3bbdbc952ac74eca8b8a660a3b88a574
Mosasaur,AbhinavRaj50,"['Mosasaurus (/ˌmoʊzəˈsɔːrəs/; “lizard of the Meuse River”) is the type genus (defining example) of the mosasaurs, an extinct group of aquatic squamate reptiles. It lived from about 82 to 66 million years ago during the Campanian and Maastrichtian stages of the Late Cretaceous. The earliest fossils of Mosasaurus known to science were found as skulls in a chalk quarry near the Dutch city of Maastricht in the late 18th century, which were initially thought to have been the bones of crocodiles or whales. One particular skull discovered around 1780, and which was seized by France during the French Revolutionary Wars for its scientific value, was famously nicknamed the “great animal of Maastricht”. In 1808, naturalist Georges Cuvier concluded it belonged to a giant marine lizard with similarities to monitor lizards but otherwise unlike any known living animal. This concept was revolutionary at the time and helped support the then-developing ideas of extinction.']",0,112,710,16,n/a,https://sketchfab.com/3d-models/mosasaur-4dbb564bcee942d1a05f4dfdbd8964f5
